"Domain","Unique.Identifier","Name","Description","Last.Change.Date","TADA.Media.Flag"
"Monitoring Location Type(MonitoringLocationTypeName)",181,"Sump","A sump is a shallow borehole (no well construction) that intersects the water table","12/17/2018 6:52:32 PM",NA
"Monitoring Location Type(MonitoringLocationTypeName)",8,"Survey Monument","Boundary monuments are placed at every corner of the property, including any angle or change of direction of the boundary line.","5/11/2011 11:18:28 PM",NA
"Monitoring Location Type(MonitoringLocationTypeName)",9,"Test Pit","A trial pit (or test pit) is an excavation of ground in order to study or sample the composition and structure of the subsurface, usually dug during a site investigation, a soil survey or a geological survey. Trial pits are dug before the construction. They are dug to determine the geology and the water table of that site.","5/11/2011 11:18:28 PM",NA
"Monitoring Location Type(MonitoringLocationTypeName)",37,"Waste Pit","A mud pit in which a supply of drilling fluid has been stored. Also, a waste pit, usually an excavated, earthen-walled pit. It may be lined with plastic to prevent soil contamination.","8/11/2006 11:18:28 PM",NA
"Monitoring Location Type(MonitoringLocationTypeName)",38,"Waste Sewer","a waste pipe that carries away sewage or surface water","8/11/2006 11:18:28 PM",NA
"Monitoring Location Type(MonitoringLocationTypeName)",39,"Well","An excavation or structure created in the ground by digging, driving, or drilling to access liquid resources, usually water.","7/26/2006 10:57:47 AM","Groundwater"
"Monitoring Location Type(MonitoringLocationTypeName)",161,"Wetland Estuarine-Ditch","Open water estuary, bay, sound Vegetated and non-vegetated brackish and saltwater ditch","9/26/2017 1:06:50 PM","Surface Water"
"Monitoring Location Type(MonitoringLocationTypeName)",40,"Wetland Estuarine-Emergent","Open water estuary, bay, sound Herbaceous marsh, fen, swale and wet meadow","8/11/2006 11:18:28 PM","Surface Water"
"Monitoring Location Type(MonitoringLocationTypeName)",41,"Wetland Estuarine-Forested","Open water estuary, bay, sound Vegetated brackish and saltwater forest","8/11/2006 11:18:28 PM","Surface Water"
"Monitoring Location Type(MonitoringLocationTypeName)",163,"Wetland Estuarine-Marsh","Open water estuary, bay, sound Vegetated brackish and saltwater marsh","9/26/2017 1:06:50 PM","Surface Water"
"Monitoring Location Type(MonitoringLocationTypeName)",165,"Wetland Estuarine-Pool","Open water estuary, bay, sound Vegetated brackish and saltwater pool: lagoons","9/20/2017 6:51:09 AM","Surface Water"
"Monitoring Location Type(MonitoringLocationTypeName)",42,"Wetland Estuarine-Scrub-Shrub","Open water estuary, bay, sound Vegetated brackish and saltwater scrub-shrub","8/11/2006 11:18:28 PM","Surface Water"
"Monitoring Location Type(MonitoringLocationTypeName)",162,"Wetland Estuarine-Tidal Creek","Open water estuary, bay, sound Vegetated brackish and saltwater tidal creek","9/26/2017 1:06:50 PM","Surface Water"
"Monitoring Location Type(MonitoringLocationTypeName)",43,"Wetland Lacustrine-Emergent","bounded by upland or by wetland dominated by trees, shrubs, persistent emergents, emergent mosses, or lichens","8/11/2006 11:18:28 PM","Surface Water"
"Monitoring Location Type(MonitoringLocationTypeName)",96,"Wetland Palustrine Pond","includes all nontidal wetlands dominated by pond and all such wetlands that occur in tidal areas where salinity due to ocean-derived salts is below 0.5 ‰","8/6/2015 2:12:48 PM",NA
"Monitoring Location Type(MonitoringLocationTypeName)",44,"Wetland Palustrine-Emergent","includes all nontidal wetlands characterized by erect, rooted, herbaceous hydrophytes, excluding mosses and lichens and all such wetlands that occur in tidal areas where salinity due to ocean-derived salts is below 0.5 ‰","8/11/2006 11:18:28 PM","Surface Water"
"Monitoring Location Type(MonitoringLocationTypeName)",45,"Wetland Palustrine-Forested","includes all nontidal wetlands dominated by trees, forest, and all such wetlands that occur in tidal areas where salinity due to ocean-derived salts is below 0.5 ‰","8/11/2006 11:18:28 PM","Surface Water"
"Monitoring Location Type(MonitoringLocationTypeName)",46,"Wetland Palustrine-Moss-Lichen","includes all nontidal wetlands dominated by mosses or lichens, and all such wetlands that occur in tidal areas where salinity due to ocean-derived salts is below 0.5 ‰","8/11/2006 11:18:28 PM","Surface Water"
"Monitoring Location Type(MonitoringLocationTypeName)",47,"Wetland Palustrine-Shrub-Scrub","includes all nontidal wetlands dominated by, shrubs, scrub and all such wetlands that occur in tidal areas where salinity due to ocean-derived salts is below 0.5 ‰","8/11/2006 11:18:28 PM","Surface Water"
"Monitoring Location Type(MonitoringLocationTypeName)",48,"Wetland Riverine-Emergent","wetlands connected by rivers. ... They are found along the edges of rivers, streams and creeks and include rivers, floodplains, marshes, lakes and billabongs. characterized by erect, rooted, herbaceous hydrophytes, excluding mosses and lichens","8/11/2006 11:18:28 PM","Surface Water"
"Monitoring Location Type(MonitoringLocationTypeName)",49,"Wetland Undifferentiated","a land area that is saturated with water, either permanently or seasonally, It primarily is characteristized by vegetation of aquatic plants, adapted to the unique hydric soil.","7/26/2006 10:57:47 AM","Surface Water"
